C,"Senyapar, HND; Colak, I; Bayindir, R",,,IEEE,"Senyapar, Hafize Nurgul Durmus; Colak, Ilhami; Bayindir, Ramazan",,,AI-Driven Smart Homes and Smart Grids: Marketing Strategies for Seamless Integration and Consumer Adoption,"12TH INTERNATIONAL CONFERENCE ON SMART GRID, ICSMARTGRID 2024",,,,,12th International Conference on Smart Grid (ICSmartGrid),"MAY 27-29, 2024","Setubal, PORTUGAL","IEEE,IEEE Ind Applicat Soc,IEEE IES,Int Journal Renewable Energy Res,IjSmartGrid,Toshiba Mitsubishi Elect Ind Syst Corp",,,,"This study explores the critical role of Artificial Intelligence (AI) in enhancing the integration and consumer adoption of smart homes and smart grids, two essential components of advancing sustainable and efficient energy management systems. At the heart of this integration is AI-driven marketing, leveraging personalized marketing strategies, predictive analytics, and automation to address technical challenges and consumer concerns effectively. The research demonstrates how AI can tailor marketing efforts to individual consumer needs and preferences, increasing engagement, trust, and adoption rates. Personalization and predictive analytics enable marketers to anticipate consumer needs and tailor their strategies accordingly, while automation ensures scalability and efficiency in marketing campaigns. The findings underscore the importance of interoperability, security, and user-friendly design in building consumer adoption and highlight the need for marketers to communicate the long-term value and benefits of smart technologies. This study proposes a multifaceted approach to AI-driven marketing, emphasizing the need for collaboration among technology developers, marketers, policymakers, and consumers to overcome barriers and realize the full potential of smart homes and smart grids.",,,,,"Bayindir, Ramazan/A-4595-2018; Durmus Senyapar, Hafize Nurgul/HPB-8726-2023; COLAK, ILHAMI/ABI-4240-2020",,,,,,,,,,,,,,,,979-8-3503-6161-2; 979-8-3503-6162-9,,,,2024,,,,,,,480,486,,10.1109/icSmartGrid61824.2024.10578198,http://dx.doi.org/10.1109/icSmartGrid61824.2024.10578198,,,,,,,,,,,,,WOS:001266130300078,View Full Record in Web of Science
J,"Gupta, S; Wang, YC; Patel, P; Czinkota, M",,,,"Gupta, Suraksha; Wang, Yichuan; Patel, Parth; Czinkota, Michael",,,"Navigating the future of AI in marketing: AI integration across borders, ethical considerations, and policy implications",INTERNATIONAL JOURNAL OF INFORMATION MANAGEMENT,,,,,,,,,,,,"The superior computing power of modern technologies, combined with their ability to provide insights through analytics on rich data sets, is helping companies enhance performance across all areas. Consequently, companies are increasingly deploying Artificial Intelligence (AI) to synchronise, reshape, and restructure their resources to achieve business objectives and enhance customer engagement in marketing efforts. AI facilitates marketing strategies by delivering personalised experiences to both local and international customers. However, the rapid pace of innovation in AI and the absence of comprehensive regulatory frameworks pose concerns. These gaps make it challenging for companies to ensure that their AI applications are compliant and safeguard stakeholder interests. Therefore, transitioning into the AI domain carries risks for companies aiming to maintain an ethical and responsible image. To mitigate these risks, integrating responsible AI usage into corporate policies can serve as a critical first step for companies.",,,,,"Wang, Yichuan/AAI-2456-2021",,,,,,,,,,,,,,0268-4012,1873-4707,,,,JUN,2025,82,,,,,,,,102871,10.1016/j.ijinfomgt.2025.102871,http://dx.doi.org/10.1016/j.ijinfomgt.2025.102871,,JAN 2025,,,,,,,,,,,WOS:001411443300001,View Full Record in Web of Science
J,"Paschen, J; Kietzmann, J; Kietzmann, TC",,,,"Paschen, Jeannette; Kietzmann, Jan; Kietzmann, Tim Christian",,,Artificial intelligence (AI) and its implications for market knowledge in B2B marketing,JOURNAL OF BUSINESS & INDUSTRIAL MARKETING,,,,,,,,,,,,"Purpose The purpose of this paper is to explain the technological phenomenon artificial intelligence (AI) and how it can contribute to knowledge-based marketing in B2B. Specifically, this paper describes the foundational building blocks of any artificial intelligence system and their interrelationships. This paper also discusses the implications of the different building blocks with respect to market knowledge in B2B marketing and outlines avenues for future research. Design/methodology/approach The paper is conceptual and proposes a framework to explicate the phenomenon AI and its building blocks. It further provides a structured discussion of how AI can contribute to different types of market knowledge critical for B2B marketing: customer knowledge, user knowledge and external market knowledge. Findings The paper explains AI from an input-processes-output lens and explicates the six foundational building blocks of any AI system. It also discussed how the combination of the building blocks transforms data into information and knowledge. Practical implications - Aimed at general marketing executives, rather than AI specialists, this paper explains the phenomenon artificial intelligence, how it works and its relevance for the knowledge-based marketing in B2B firms. The paper highlights illustrative use cases to show how AI can impact B2B marketing functions. Originality/value The study conceptualizes the technological phenomenon artificial intelligence from a knowledge management perspective and contributes to the literature on knowledge management in the era of big data. It addresses calls for more scholarly research on AI and B2B marketing.",,,,,"Paschen, Jeannette/AAT-9497-2021; Kietzman, Tim/AAA-5771-2019; Kietzmann, Jan/ABF-6025-2020","Kietzmann, Jan/0000-0002-3576-994X",,,,,,,,,,,,,0885-8624,2052-1189,,,,AUG 5,2019,34,7,,,,,1410,1419,,10.1108/JBIM-10-2018-0295,http://dx.doi.org/10.1108/JBIM-10-2018-0295,,,,,,,,,,,,,WOS:000489029000003,View Full Record in Web of Science
J,"Qadri, UA; Moustafa, AMA; Abd Ghani, M",,,,"Qadri, Usman Ahmad; Moustafa, Alsadig Mohamed Ahmed; Abd Ghani, Mazuri",,,They misused me! Digital literacy's dual role in AI marketing manipulation and unethical young consumer behavior,YOUNG CONSUMERS,,,,,,,,,,,,"PurposeArtificial intelligence (AI)-driven marketing has transformed the landscape of consumer interactions, but it also raises ethical concerns regarding perceived manipulation and subsequent unethical young consumer behavior. This study aims to investigate the direct and indirect effects of AI-driven marketing on unethical young consumer behavior, with digital literacy as a moderating variable. The authors introduce and conceptualize a digital literacy construct that influences how young consumers perceive and react to manipulative AI-driven marketing tactics.Design/methodology/approachUsing the Elaboration Likelihood Model (ELM) and the Persuasion Knowledge Model (PKM), this research explores how digital literacy influences the reception of AI-driven marketing and moderates the effects of perceived manipulative tactics. This study adopts a three-wave, time-lagged survey method among young consumers in urban Pakistan, integrating measures of AI-driven marketing techniques, perceived manipulation, digital literacy and unethical consumer behavior.FindingsThe results reveal that perceived manipulation mediates the relationship between AI-driven marketing and unethical young consumer behavior. Digital literacy significantly moderates this effect, indicating that higher digital literacy levels can mitigate the negative impacts of perceived manipulation. Conversely, lower digital literacy amplifies the negative impacts of perceived manipulation.Practical implicationsThe findings underscore the need for marketers to foster transparency and ethical practices in AI-driven strategies. Enhancing consumer digital literacy can serve as a protective factor against unethical marketing practices.Originality/valueThis study contributes to the understanding of digital literacy's protective role against unethical AI-driven marketing practices. It extends existing models of persuasion and consumer response by demonstrating how digital literacy reshapes traditional consumer response frameworks in the context of AI-driven environments.",,,,,"Abd.Ghani, Mazuri/AAW-4399-2021",,,,,,,,,,,,,,1758-7212,1747-3616,,,,2025 JAN 21,2025,,,,,,,,,,10.1108/YC-08-2024-2207,http://dx.doi.org/10.1108/YC-08-2024-2207,,JAN 2025,,,,,,,,,,,WOS:001397634100001,View Full Record in Web of Science
J,"Karimova, GZ; Kim, YD; Shirkhanbeik, A",,,,"Karimova, Gulnara Z.; Kim, Yevgeniya D.; Shirkhanbeik, Amir",,,Poietic symbiosis or algorithmic subjugation: generative AI technology in marketing communications education,EDUCATION AND INFORMATION TECHNOLOGIES,,,,,,,,,,,,"This exploratory study investigates the convergence of marketing communications and AI-powered technology in higher education, adopting a perspective on student interactions with generative AI tools. Through a comprehensive content analysis of learners' responses, we employed a blend of manual scrutiny, Python-generated Word Cloud, and Latent Dirichlet Allocation (LDA) to expose the nature of interaction between learners and AI tools. Our findings indicate that learners predominantly adhere to the perception of AI as a tool resembling a 'brush' in the creative process, rather than as an active co-creator - the percaption that is aligned with the conventional tool-user dynamic. Students articulated a dual narrative regarding AI: they acknowledged its utility in enhancing creativity, yet expressed concerns about overreliance potentially eroding their own creative skills. Heidegger's exploration of different modes of 'revealing' and Deleuze and Guattari's notions of desiring machines and machinic enslavement suggest an alternative perspective where technology, and by extension AI-empowered technology, can contribute to a deeper existential understanding. This study points out the possibility of moving beyond a simple tool-user model, suggesting the emergence of more complex plausible scenarios of interaction: poietic symbiosis or algorithmic subjugation.",,,,,"Karimova, Gulnara Z./HIZ-8233-2022","Karimova, Gulnara Z./0000-0003-1808-8373",,,,,,,,,,,,,1360-2357,1573-7608,,,,FEB,2025,30,2,,,,,2185,2209,,10.1007/s10639-024-12877-8,http://dx.doi.org/10.1007/s10639-024-12877-8,,JUL 2024,,,,,,,,,,,WOS:001272244500004,View Full Record in Web of Science
J,"Takefuji, Y",,,,"Takefuji, Yoshiyasu",,,AI-Driven Analysis of Drug Marketing Efficiency: Unveiling FDA Approval to Market Release Dynamics,AAPS JOURNAL,,,,,,,,,,,,"This paper explores a novel approach using generative AI to enhance drug marketing strategies in the US pharmaceutical sector. By leveraging an official dataset sourced from the US government, the AI generates Python code to analyze the time interval between FDA approval dates and market release dates. The analysis identifies 370 manufacturers who achieved zero-day marketing-referring to drugs marketed immediately upon FDA approval-and 174 manufacturers who marketed their products within less than seven days of approval. Notably, 947 drug products were found to have been marketed prior to FDA approval, raising significant regulatory and ethical concerns that necessitate further discussion. The findings indicate that 174 drug manufacturers have the potential to optimize their marketing strategies to achieve zero-day timelines, prompting an examination of the feasibility of such acceleration within the current regulatory framework and its implications for industry practices. Additionally, this paper discusses the broader impact of AI-driven strategies in the pharmaceutical sector, highlighting their potential to not only enhance marketing speed but also improve aspects such as compliance and decision-making efficiency. Furthermore, a tutorial on implementing generative AI is provided, detailing how it can be utilized to achieve marketing objectives through interactive conversations with the AI. This practical application demonstrates the technology's capabilities using real dataset analysis and reveals significant findings that could inform future strategies within the industry. The research objectives and their broader implications underscore the need for ongoing dialogue about the ethical and regulatory dimensions of AI in pharmaceutical marketing.",,,,,"Takefuji, Yoshiyasu/AAI-8819-2020","Takefuji, Yoshiyasu/0000-0002-1826-742X",,,,,,,,,,,,,1550-7416,,,,,FEB 20,2025,27,2,,,,,,,48,10.1208/s12248-025-01039-4,http://dx.doi.org/10.1208/s12248-025-01039-4,,,,,,,,39979651,,,,,WOS:001427059000001,View Full Record in Web of Science
J,"Alsiehemy, A",,,,"Alsiehemy, Ali",,,Emergence of Digital Marketing in Current Scenario and Implementation of AI to Improve the Productivity of a Concern,PACIFIC BUSINESS REVIEW INTERNATIONAL,,,,,,,,,,,,"Businesses have been on the rise in current decades as an outcome of digital progressions. The promotion has achieved a phase in its evolution where it is essential to modify to digitalization. While it seems to be a boost for marketing, every AI-based computerised programs and platforms reduce the burden of traditional advertising and personalization operations. In many cases, the systems used for online marketing include algorithms for determining the optimum combinations, while in others, businesses take the initiative to build and deploy unique methods in-house. The authors' goal is to summarize the prevailing status of AI in marketing efforts and facilitate implementations of a smart marketing approach to increase a site's exposure using keywords. This article also focuses on the various benefits of AI in Digital Marketing. Along with all these, the author discussed how Artificial Intelligence is used in today's digital marketing scenario to increase the productivity of any company.",,,,,"Alsiehemy, Ali/IYT-2757-2023",,,,,,,,,,,,,,0974-438X,,,,,JAN,2023,15,7,,,,,19,27,,,,,,,,,,,,,,,,WOS:001036814100003,View Full Record in Web of Science
J,"Overgoor, G; Chica, M; Rand, W; Weishampel, A",,,,"Overgoor, Gijs; Chica, Manuel; Rand, William; Weishampel, Anthony",,,Letting the Computers Take Over: Using AI to Solve Marketing Problems,CALIFORNIA MANAGEMENT REVIEW,,,,,,,,,,,,"Artificial intelligence (AI) has proven to be useful in many applications from automating cars to providing customer service responses. However, though many firms want to take advantage of AI to improve marketing, they lack a process by which to execute a Marketing AI project. This article discusses the use of AI to provide support for marketing decisions. Based on the established Cross-Industry Standard Process for Data Mining (CRISP-DM) framework, it creates a process for managers to use when executing a Marketing AI project and discusses issues that might arise. It explores how this framework was used to develop three cutting-edge Marketing AI applications.",,,,,"Rand, Bill/HLQ-7168-2023; Chica Serrano, Manuel/F-6062-2011","Rand, William/0000-0002-8294-1757; Chica Serrano, Manuel/0000-0002-4717-1056",,,,,,,,,,,,,0008-1256,2162-8564,,,,AUG,2019,61,4,,,SI,,156,185,8.12562E+12,10.1177/0008125619859318,http://dx.doi.org/10.1177/0008125619859318,,JUL 2019,,,,,,,,,,,WOS:000474966800001,View Full Record in Web of Science
J,"Cillo, P; Rubera, G",,,,"Cillo, Paola; Rubera, Gaia",,,Generative AI in innovation and marketing processes: A roadmap of research opportunities,JOURNAL OF THE ACADEMY OF MARKETING SCIENCE,,,,,,,,,,,,"Nowadays, we are witnessing the exponential growth of Generative AI (GenAI), a group of AI models designed to produce new content. This technology is poised to revolutionize marketing research and practice. Since the marketing literature about GenAI is still in its infancy, we offer a technical overview of how GenAI models are trained and how they produce content. Following this, we construct a roadmap for future research on GenAI in marketing, divided into two main domains. The first domain focuses on how firms can harness the potential of GenAI throughout the innovation process. We begin by discussing how GenAI changes consumer behavior and propose research questions at the consumer level. We then connect these emerging consumer insights with corresponding firm marketing strategies, presenting research questions at the firm level. The second set of research questions examines the likely consequences of using GenAI to analyze: (1) the relationship between market-based assets and firm value, and (2) consumer skills, preferences, and role in marketing processes.",,,,,"RUBERA, GAIA/T-5142-2019; CILLO, PAOLA/KCZ-0688-2024","RUBERA, GAIA/0000-0001-6971-0500; CILLO, PAOLA/0000-0002-2496-8900",,,,,,,,,,,,,0092-0703,1552-7824,,,,2024 AUG 26,2024,,,,,,,,,,10.1007/s11747-024-01044-7,http://dx.doi.org/10.1007/s11747-024-01044-7,,AUG 2024,,,,,,,,,,,WOS:001297777700001,View Full Record in Web of Science
J,"Fayed, AE",,,,"Fayed, Abeer Elsayed",,,ARTIFICIAL INTELLIGENCE FOR MARKETING PLAN: THE CASE FOR E-MARKETING COMPANIES,MARKETING AND MANAGEMENT OF INNOVATIONS,,,,,,,,,,,,"This paper summarises the arguments and counterarguments within the scientific discussion on artificial intelligence (AI) in preparing a marketing plan for e-marketing organizations. This research aims to identify the extent of the contribution of AI in preparing the marketing plan. The author noted that intended to know how e-marketing companies could use AI techniques in situation analysis, analyze competitors' strategies, strategic goals, preparing marketing strategies, preparing an estimated marketing budget, and control a marketing plan. Systematization of the scientific background and approaches on preparing a marketing plan for e-marketing organizations indicates that many companies, especially small companies, marketing their products via the Internet, cannot develop a successful marketing plan. In turn, it could be solved through the use of AI techniques. The study was conducted on a group of companies that market their products via the Internet in the Kingdom of Saudi Arabia. To gain the research goal, this study was carried out in the following logical sequence: 1) developing the stratified sample by collecting statistical information for 141 company in a variety of fields; 2) analyzing the data using SPSS; 3) predicting how AI could be used in preparing the marketing plan; 4) identifying the arrangement of the steps for preparing the marketing plan in terms of the ability of AI techniques. The methodological tools of the study were methods of the multiple regression analysis and the Friedman test. The study empirically confirms and theoretically proves that AI contributes significantly in developing marketing plans through its great contribution to environmental analysis and analysis of competitors' strategies and setting marketing goals. Besides, AI contributes to preparing the budget and appreciating the marketing plan, to its evaluation and control. The author mentioned that AI provides understanding and selecting target markets and sectors, targeting customers, and preparing appropriate marketing mix strategies for each market sector. Therefore, the study provides recommendations to online organizations to use AI in preparing their marketing plan because of its great ability to contribute to this.",,,,,"Fayed, Abeer/GRX-4677-2022","Fayed, Abeer/0000-0003-4406-894X; Fayed, Abeer/0000-0001-9567-622X",,,,,,,,,,,,,2218-4511,,,,,,2021,,1,,,,,81,95,,10.21272/mmi.2021.1-07,http://dx.doi.org/10.21272/mmi.2021.1-07,,,,,,,,,,,,,WOS:000659279400007,View Full Record in Web of Science
J,"Beninger, S; Reppel, A; Stanton, J; Watson, F",,,,"Beninger, Stefanie; Reppel, Alex; Stanton, Julie; Watson, Forrest",,,Facilitating Generative AI Literacy in the Face of Evolving Technology: Interventions in Marketing Classrooms,JOURNAL OF MARKETING EDUCATION,,,,,,,,,,,,"The emergence of generative AI (GenAI) has illustrated that higher education needs to adapt to the technology. Its speed of evolution requires that we adequately prepare students for an ever-changing landscape. Toward achieving that aim, we draw on the concept of interpretive flexibility, where the interpretations, uses, and outcomes of a new technology can differ and evolve over time, often with dominant stakeholders controlling the process. To engage marketing students in this process, we propose that they be presented with these diverse interpretations now as part of GenAI literacy. Specifically, we offer three small-scale pedagogical interventions designed to address this urgent need. Given the newness of GenAI, our interventions are designed to be infused into existing marketing instruction, instead of requiring a redesign of a curriculum. With each intervention, students not only significantly decrease their confidence in the accuracy of what GenAI produces but also see reasons to examine the implications of it. Both these outcomes, we suggest, could help to maintain interpretive flexibility required to properly respond to and guide the technology as its uses, impacts, and evolution become evident. We encourage educators to prioritize a comprehensive notion of GenAI literacy in their pedagogy to maintain interpretive flexibility.",,,,,"Reppel, Alex/HOF-0232-2023; Watson, Forrest/ABB-8269-2020",,,,,,,,,,,,,,0273-4753,1552-6550,,,,2025 FEB 18,2025,,,,,,,,,,10.1177/02734753251316569,http://dx.doi.org/10.1177/02734753251316569,,FEB 2025,,,,,,,,,,,WOS:001423733400001,View Full Record in Web of Science
J,"Pagani, M; Wind, Y",,,,"Pagani, Margherita; Wind, Yoram",,,Unlocking Marketing Creativity Using Artificial Intelligence,JOURNAL OF INTERACTIVE MARKETING,,,,,,,,,,,,"This article examines the role of artificial intelligence (AI) in enhancing marketing creativity by analyzing the synergy between computational and human creative processes. Through two studies, the authors investigate nongenerative and generative AI applications within marketing contexts using a conceptually driven and empirically derived approach. In Study 1, the authors observe how creative individuals, particularly artists, utilize AI and its effects on their creative experiences, revealing AI's role as (1) a new instrumental resource, (2) a tool for exploring possibilities, and (3) a means to deconstruct the creative process. Study 2 assesses 1,036 AI systems (2015-2021) and 241,292 AI models (2022-2024), categorizing them into four clusters and three levels of observed creativity. From these insights, the authors introduce a framework for AI-enabled creativity: (1) inspiring agile methods, (2) augmenting human creativity, and (3) inspiring unconventional thinking. Validated by three workshops, this framework equips marketing leaders with a deeper comprehension of AI's creative potential. The authors advocate for AI integration within agile, augmented, and unconventional marketing approaches, advancing our understanding of AI's contribution to marketing creativity. Additionally, they propose a research roadmap for empirical validation in real-world applications.",,,,,,,,,,,,,,,,,,,1094-9968,1520-6653,,,,FEB,2025,60,1,,,,,1,24,,10.1177/10949968241265855,http://dx.doi.org/10.1177/10949968241265855,,AUG 2024,,,,,,,,,,,WOS:001295674600001,View Full Record in Web of Science
J,"Stone, M; Aravopoulou, E; Ekinci, Y; Evans, G; Hobbs, M; Labib, A; Laughlin, P; Machtynger, J; Machtynger, L",,,,"Stone, Merlin; Aravopoulou, Eleni; Ekinci, Yuksel; Evans, Geraint; Hobbs, Matt; Labib, Ashraf; Laughlin, Paul; Machtynger, Jon; Machtynger, Liz",,,Artificial intelligence (AI) in strategic marketing decision-making: a research agenda,BOTTOM LINE,,,,,,,,,,,,"Purpose The purpose of this paper is to review literature about the applications of artificial intelligence (AI) in strategic situations and identify the research that is needed in the area of applying AI to strategic marketing decisions. Design/methodology/approach The approach was to carry out a literature review and to consult with marketing experts who were invited to contribute to the paper. Findings There is little research into applying AI to strategic marketing decision-making. This research is needed, as the frontier of AI application to decision-making is moving in many management areas from operational to strategic. Given the competitive nature of such decisions and the insights from applying AI to defence and similar areas, it is time to focus on applying AI to strategic marketing decisions. Research limitations/implications The application of AI to strategic marketing decision-making is known to be taking place, but as it is commercially sensitive, data is not available to the authors. Practical implications There are strong implications for all businesses, particularly large businesses in competitive industries, where failure to deploy AI in the face of competition from firms, who have deployed AI to improve their decision-making could be dangerous. Social implications The public sector is a very important marketing decision maker. Although in most cases it does not operate competitively, it must make decisions about making different services available to different citizens and identify the risks of not providing services to certain citizens; so, this paper is relevant to the public sector. Originality/value To the best of the authors' knowledge, this is one of the first papers to probe deployment of AI in strategic marketing decision-making.",,,,,"Machtynger, Jon/JGM-4985-2023; Labib, Ashraf/F-4792-2019","Ekinci, Yuksel/0000-0001-5063-013X; Labib, Ashraf/0000-0002-5481-5833",,,,,,,,,,,,,0888-045X,2054-1724,,,,APR 13,2020,33,2,,,,,183,200,,10.1108/BL-03-2020-0022,http://dx.doi.org/10.1108/BL-03-2020-0022,,APR 2020,,,,,,,,,,,WOS:000527924200001,View Full Record in Web of Science
