J,"Pan, Y; Froese, FJ",,,,"Pan, Yuan; Froese, Fabian J.",,,An interdisciplinary review of AI and HRM: Challenges and future directions,HUMAN RESOURCE MANAGEMENT REVIEW,,,,,,,,,,,,"Artificial intelligence (AI) has the potential to change the future of human resource management (HRM). Scholars from different disciplines have contributed to the field of AI in HRM but with rather insufficient cross-fertilization, thus leading to a fragmented body of knowledge. In response, we conducted a systematic, interdisciplinary review of 184 articles to provide a comprehensive overview. We grouped prior research into four categories based on discipline: management and economics, computer science, engineering and operations, and others. The findings reveal that studies in different disciplines had different research foci and utilized different methods. While studies in the technical disciplines tended to focus on the development of AI for specific HRM functions, studies from the other disciplines tended to focus on the con-sequences of AI on HRM, jobs, and labor markets. Most studies in all categories were relatively weak in theoretical development. We therefore offer recommendations for interdisciplinary col-laborations, propose a unified definition of AI, and provide implications for research and practice.",,,,,"Froese, Fabian/AAH-6203-2020; Pan, Yuan/GOE-6309-2022","Froese, Fabian Jintae/0000-0003-2220-4250; Pan, Yuan/0000-0002-9009-5140",,,,,,,,,,,,,1053-4822,1873-7889,,,,MAR,2023,33,1,,,,,,,100924,10.1016/j.hrmr.2022.100924,http://dx.doi.org/10.1016/j.hrmr.2022.100924,,DEC 2022,,,,,,,,,,,WOS:000897097700007,View Full Record in Web of Science
J,"Pena, AA",,,,"Pena, Anita Alves",,,Catholic Social Economics in ASE Journals: An 80-Year Review,FORUM FOR SOCIAL ECONOMICS,,,,,,,,,,,,"In December of 1942 in the first article published in the Review of Social Economy (Volume 1, Issue 1, page 1), Rt. Rev. Msgr. John A. Ryan put forth 'Two Objectives for Catholic Economists'. These objectives started with 'to make the ethical aspect of the economic doctrine as prominent as possible' and continued with 'to study and recommend reforms in our economic institutions'. More than 80 years later, have decades of economic and political changes altered the agenda? This paper represents a first entry toward answering this question by critically reviewing the history of qualitative and quantitative contributions by economists concerned with Catholicism in the two flagship journals of the Association for Social Economics. The paper is based on systematic literature review using algorithmic search parameters and generative AI to understand contributions in these journals relative to Msgr. Ryan's original objectives.",,,,,,,,,,,,,,,,,,,0736-0932,1874-6381,,,,APR 3,2025,54,2,,,,,141,157,,10.1080/07360932.2025.2483490,http://dx.doi.org/10.1080/07360932.2025.2483490,,MAR 2025,,,,,,,,,,,WOS:001455461300001,View Full Record in Web of Science
J,"Yousaf, I; Ijaz, MS; Umar, M; Li, YS",,,,"Yousaf, Imran; Ijaz, Muhammad Shahzad; Umar, Muhammad; Li, Yanshuang",,,"Exploring volatility interconnections between AI tokens, AI stocks, and fossil fuel markets: evidence from time and frequency-based connectedness analysis",ENERGY ECONOMICS,,,,,,,,,,,,"Energy and artificial intelligence (AI) are two of the top fields of the present time. However, investors of conventional energy assets have yet to consider the rapidly emerging AI-based assets for diversification. Owing to the rise of new categories of assets in the last two decades, which has sparked the interest of global investors to attain the most favorable outcomes, we examine volatility connectedness between AI stocks (MSFT-Microsoft, GOOG-Alphabet, AMZN-Amazon), AI tokens (AGIX-SingularityNET, OCEAN-Ocean Protocol, FET-Fetch.ai), and fossil fuel markets (WTI, BRENT, and GAS-natural gas) over the period from May 6, 2019, to July 8, 2023. We apply a novel three-dimensional framework in which we model time-domain and frequency-domain volatility spillovers at the median-, lower- and upper-quantiles in static as well as dynamic settings to achieve the objectives of this paper. We find the variation in static and dynamic connectedness between markets over timefrequencies and quantiles. Results reveal that AGIX, BRENT, FET, MSFT, and WTI are recipients, whereas AMZN, GAS, GOOG, and OCEAN are transmitters of the spillovers at the median quantile. Furthermore, we demonstrated that the short-term and long-term metrics for dynamic total connectedness might not consistently exhibit the same direction. Moreover, our analysis indicates that the short-term fluctuations predominantly influence the network's overall shock transmission, while the longer-term aspect has the potential to alter the role of a net transmitter or receiver of shocks. These findings provide portfolio managers, regulators, and policymakers with valuable information regarding portfolio adjustments, hedging, and financial stability.",,,,,"Yousaf, Imran/AAE-1107-2019; Umar, Muhammad/AFG-9168-2022; Li, Yanshuang/HLX-1180-2023","Li, Yanshuang/0000-0001-6218-7462; Yousaf, Imran/0000-0003-1968-293X",,,,,,,,,,,,,0140-9883,1873-6181,,,,MAY,2024,133,,,,,,,,107490,10.1016/j.eneco.2024.107490,http://dx.doi.org/10.1016/j.eneco.2024.107490,,APR 2024,,,,,,,,,,,WOS:001217174800001,View Full Record in Web of Science
J,"Wu, D; Zhang, SL; Ma, ZY; Yue, XG; Dong, RK",,,,"Wu, Di; Zhang, Shuling; Ma, Zhiyuan; Yue, Xiao-Guang; Dong, Rebecca Kechen",,,Unlocking Potential: Key Factors Shaping Undergraduate Self-Directed Learning in AI-Enhanced Educational Environments,SYSTEMS,,,,,,,,,,,,"This study investigates the factors influencing undergraduate students' self-directed learning (SDL) abilities in generative Artificial Intelligence (AI)-driven interactive learning environments. The advent of generative AI has revolutionized interactive learning environments, offering unprecedented opportunities for personalized and adaptive education. Generative AI supports teachers in delivering smart education, enhancing students' acceptance of technology, and providing personalized, adaptive learning experiences. Nevertheless, the application of generative AI in higher education is underexplored. This study explores how these AI-driven platforms impact undergraduate students' self-directed learning (SDL) abilities, focusing on the key factors of teacher support, learning strategies, and technology acceptance. Through a quantitative approach involving surveys of 306 undergraduates, we identified the key factors of motivation, technological familiarity, and the quality of AI interaction. The findings reveal the mediating roles of self-efficacy and learning motivation. Also, the findings confirmed that improvements in teacher support and learning strategies within generative AI-enhanced learning environments contribute to increasing students' self-efficacy, technology acceptance, and learning motivation. This study contributes to uncovering the influencing factors that can inform the design of more effective educational technologies and strategies to enhance student autonomy and learning outcomes. Our theoretical model and research findings deepen the understanding of applying generative AI in higher education while offering important research contributions and managerial implications.",,,,,"Yue, XiaoGuang/AAC-7781-2019; Ma, Zhiyuan/JLL-8693-2023","Zhang, Shuling/0009-0002-7268-2584; Dong, Rebecca Kechen/0000-0002-2486-4511",,,,,,,,,,,,,,2079-8954,,,,SEP,2024,12,9,,,,,,,332,10.3390/systems12090332,http://dx.doi.org/10.3390/systems12090332,,,,,,,,,,,,,WOS:001323879500001,View Full Record in Web of Science
J,"Hua, GB",,,,"Hua, Goh Bee",,,The state of applications of quantitative analysis techniques to construction economics and management (1983 to 2006),CONSTRUCTION MANAGEMENT AND ECONOMICS,,,,,,,,,,,,"With increasing complexity of construction industry problems, researchers are experimenting with computationally rigorous techniques with the aim of seeking innovative solutions. In order to trace the applications of quantitative analysis techniques to research in the two fields of construction economics and construction management for both conventional and AI techniques, the methodology involves compiling all the relevant papers from the top two ranking construction management journals, namely, Construction Management and Economics and ASCE's Journal of Construction Engineering and Management. The period is from 1983 to 2006. The compiled papers are classified by field, area (or topic), technique applied and year of publication to enable time series and cross-sectional analyses of the data. Mainly, the results are depicted as trends when the patterns of distribution of the papers are plotted over time. The three findings are: (1) for construction economics, the overall increasing trend is higher for papers that have applied conventional techniques; (2) for construction management, there is a clear positive trend for papers that have applied AI techniques which starts from 1995; and (3) the areas (or topics) of construction management that have increasingly higher growth in the application of AI techniques are optimization of site operations and optimization of project time, cost and resources allocation. Two broad recommendations are made that relate to advancing the fields of construction economics and construction management with the view that researchers must better enable themselves to build tools that incorporate intelligence as innovative solutions for increasingly complex problems.",,,,,,,,,,,,,,,,,,,0144-6193,1466-433X,,,,,2008,26,5,,,,,485,497,,10.1080/01446190801998716,http://dx.doi.org/10.1080/01446190801998716,,,,,,,,,,,,,WOS:000213245900006,View Full Record in Web of Science
J,"Lobova, SV; Bogoviz, A; Alekseev, AN",,,,"Lobova, Svetlana, V; Bogoviz, Aleksei, V; Alekseev, Alexander N.",,,Sustainable AI in environmental economics and management: Current trends and post-COVID perspective,FRONTIERS IN ENVIRONMENTAL SCIENCE,,,,,,,,,,,,,,,,,"Alekseev, Alexander/H-9193-2018; Bogoviz, Aleksei/H-1867-2017; Lobova, Svetlana/H-6304-2014","Bogoviz, Aleksei/0000-0002-6667-5284; Lobova, Svetlana/0000-0002-5784-1260",,,,,,,,,,,,,,2296-665X,,,,AUG 5,2022,10,,,,,,,,951672,10.3389/fenvs.2022.951672,http://dx.doi.org/10.3389/fenvs.2022.951672,,,,,,,,,,,,,WOS:000842990400001,View Full Record in Web of Science
C,"Tomczyk, P; Brggemann, P; Mergner, N; Petrescu, M",,"Martinez, LF; Bruggemann, P; Martinez-Lopez, FJ",,"Tomczyk, Przemyslaw; Bruggemann, Philipp; Mergner, Niklas; Petrescu, Maria",,,Exploring AI's Role in Literature Searching: Traditional Methods Versus AI-Based Tools in Analyzing Topical E-Commerce Themes,"ADVANCES IN DIGITAL MARKETING AND ECOMMERCE, DMEC 2024",Springer Proceedings in Business and Economics,,,,5th International Conference on Digital Marketing & eCommerce Conference (DMEC),"JUN 26-28, 2024","Barcelona, SPAIN",,,,,"This paper delves into the evolving landscape of Artificial Intelligence (AI) and its impact on literature reviews, exploring the potential of AI-based tools in comparison to traditional methods. Acknowledging AI's transformative influence on diverse sectors and its ethical implications, the study addresses the scarcity of academic literature on specificAI-based tools like ChatGPT. The research poses four critical questions comparing the accuracy, quality, uniqueness, and qualified uniqueness of AI-based tools against traditional methods. A theoretical framework based on Algorithmic Theory and Data Dependency Theory is employed to scrutinize the AI's performance in terms of algorithms, machine learning models, and data quality. The methodology involves testing nine topical e-commerce themes using Scopus, Web of Science, Elicit, and SciSpace, leading to nuanced conclusions. While traditional methods excel in accuracy and quality, AI-based tools demonstrate potential in uniqueness, emphasizing their complementary role in literature reviews. The study underscores the importance of judiciously integrating AI-based tools in literature reviews and advocates for continued research exploring new applications and diverse fields. Ultimately, the paper provides valuable insights into leveraging AI-based tools to enhance traditional literature review practices in research and professional domains.",,,,,"Tomczyk, Przemyslaw/Q-3531-2019; Mergner, Niklas/JTI-2963-2023; Petrescu, Maria/HGA-4039-2022; Brggemann, Philipp/ACT-2967-2022",,,,,,,,,,,,,,2198-7246,2198-7254,978-3-031-62137-6; 978-3-031-62135-2; 978-3-031-62134-5,,,,2024,,,,,,,141,148,,10.1007/978-3-031-62135-2_15,http://dx.doi.org/10.1007/978-3-031-62135-2_15,,,,,,,,,,,,,WOS:001297981500015,View Full Record in Web of Science
J,"Chen, DL",,,,"Chen, Daniel L.",,,Incremental AI,ASIAN JOURNAL OF LAW AND ECONOMICS,,,,,,,,,,,,"The usual narrative is backlash to artificial intelligence (AI). A recent study found that when judges were given decision-support, it ended up increasing disparities-not because the algorithm was biased-in fact the algorithm would have resulted in lower disparities. But the judges selectively paid attention to the algorithm, which resulted in greater disparities. This article argues for an incremental approach leveraging recent theoretical insights from social preference economics. The core insight is that judges are moral decision-makers-you're right or wrong, good or bad-and to understand what motivates these decision-makers, one might turn to self-image motives-a topic of active behavioral research in recent years. Each stage leverages motives related to the self: self-image, self-improvement, self-understanding, and ego. In stage 1, people use AI as a support tool, speeding up existing processes (for example, by prefilling forms). Once they're used to this, they can more easily accept an added functionality (Stage 2) in which AI becomes a choice monitor, pointing out choice inconsistencies and reminding the human of her prior choices in similar situations. Stage 3 elevates the AI to the role of a more general coach, providing outcome feedback on choices and highlighting decision patterns. Then, in stage 4, the AI brings in other people's decision histories and patterns, serving as a platform for a community of experts. This framework contrasts with the current framework where the AI simply recommends an optimal decision.",,,,,,,,,,,,,,,,,,,2194-6086,2154-4611,,,,MAY 22,2023,14,1,,,,,1,16,,10.1515/ajle-2023-0018,http://dx.doi.org/10.1515/ajle-2023-0018,,APR 2023,,,,,,,,,,,WOS:000979534300001,View Full Record in Web of Science
J,"Han, MH; Yang, TJ; Zhong, JH; Zhong, YL",,,,"Han, Minghui; Yang, Tianjian; Zhong, Junhao; Zhong, Yilin",,,AI applications and supply chain concentration,APPLIED ECONOMICS LETTERS,,,,,,,,,,,,"This study explores the relationship between AI applications and supply chain concentration. We measure the AI applications of Chinese listed firms based on text analytics on annual reports from 2007 to 2021. Our results show that AI applications reduce supply chain concentration, and these results are robust to endogeneity examination. In addition, AI reduces companies' supply chain concentration by enhancing their bargaining power and, in turn, improving their operational performance.",,,,,"Yang, Tianjian/GWV-3692-2022; zhong, yilin/GRD-4149-2022","Zhong, Yilin/0000-0002-2852-6384; Zhong, Junhao/0000-0001-5797-1228",,,,,,,,,,,,,1350-4851,1466-4291,,,,NOV 27,2024,31,20,,,,,2099,2103,,10.1080/13504851.2023.2210813,http://dx.doi.org/10.1080/13504851.2023.2210813,,MAY 2023,,,,,,,,,,,WOS:000985931100001,View Full Record in Web of Science
J,"Igna, I; Venturini, F",,,,"Igna, Ioana; Venturini, Francesco",,,The determinants of AI innovation across European firms,RESEARCH POLICY,,,,,,,,,,,,"Using patent data for a panel sample of European companies between 1995 and 2016 we explore whether the inventive success in Artificial Intelligence (AI) is related to earlier firms' innovation in the area of Information and Communication Technology (ICT), and identify which company characteristics and external factors shape this performance. We show that AI innovation presents strong dynamic returns (learning effects) and benefits from complementaries with knowledge earlier developed in the area of network and communication technologies, high-speed computing and data analysis, and more recently cognition and imaging. AI patent productivity increases with the scale of firm innovation, and is lower for companies with narrow technological competences. There is evidence of knowledge spillovers from ICT innovators to AI innovators, but this effect is confined to the frontier firms of the new technological field. Our findings suggest that, with the take-off of the new technology, the technological lead of top AI innovators has increased due to the accumulation of internal competences and the expanding knowledge base. These trends help explain the concentration process of the world's data market.",,,,,"Venturini, Francesco/AFC-0519-2022","Venturini, Francesco/0000-0002-7295-268X",,,,,,,,,,,,,0048-7333,1873-7625,,,,MAR,2023,52,2,,,,,,,104661,10.1016/j.respol.2022.104661,http://dx.doi.org/10.1016/j.respol.2022.104661,,NOV 2022,,,,,,,,,,,WOS:000933565600001,View Full Record in Web of Science
C,"Massri, MB; Spahiu, B; Grobelnik, M; Alexiev, V; Palmonari, M; Roman, D",,,ACM,"Massri, M. Besher; Spahiu, Blerina; Grobelnik, Marko; Alexiev, Vladimir; Palmonari, Matteo; Roman, Dumitru",,,Towards InnoGraph: A Knowledge Graph for AI Innovation,"COMPANION OF THE WORLD WIDE WEB CONFERENCE, WWW 2023",,,,,32nd World Wide Web Conference (WWW),"APR 30-MAY 04, 2023","Austin, TX","Assoc Comp Machinery,Amazon Science,Baidu,Megagon Labs,Zhipu AI,Google,Booking Com,eBay,Bloomberg Engn,Netflix,ACM SIGWEB,Univ Texas Austin, Sch Informat,Data World,Inst Fdn Machine Learning",,,,"Researchers seeking to comprehend the state-of-the-art innovations in a particular field of study must examine recent patents and scientific articles in that domain. Innovation ecosystems consist of interconnected information about entities such as researchers, institutions, projects, products, and technologies. However, representing such information in a machine-readable format is challenging because concepts like knowledge are not easily represented. Nonetheless, even a partial representation of innovation ecosystems provides valuable insights. Therefore, representing innovation ecosystems as knowledge graphs (KGs) would enable advanced data analysis and generate new insights. To this end, we propose InnoGraph, a framework that integrates multiple heterogeneous data sources to build a Knowledge Graph of the worldwide AI innovation ecosystem.",,,,,"Palmonari, Matteo/AAI-4804-2021; Spahiu, Blerina/ABF-8205-2020; Alexiev, Vladimir/J-3403-2017","Grobelnik, Marko/0000-0001-7373-5591; PALMONARI, MATTEO/0000-0002-1801-5118; Massri, M.Besher/0000-0001-9134-4025; Alexiev, Vladimir/0000-0001-7508-7428",,,,,,,,,,,,,,,978-1-4503-9416-1,,,,2023,,,,,,,843,849,,10.1145/3543873.3587614,http://dx.doi.org/10.1145/3543873.3587614,,,,,,,,,,,,,WOS:001124276300168,View Full Record in Web of Science
J,"Thanh, BN; Vo, DTH; Nhat, MN; Pham, TTT; Trung, HT; Zuan, SH",,,,"Thanh, Binh Nguyen; Vo, Diem Thi Hong; Nhat, Minh Nguyen; Pham, Thi Thu Tra; Trung, Hieu Thai; Zuan, Son Ha",,,Race with the machines: Assessing the capability of generative AI in solving authentic assessments,AUSTRALASIAN JOURNAL OF EDUCATIONAL TECHNOLOGY,,,,,,,,,,,,"In this study, we introduce a framework designed to help educators assess the effectiveness of popular generative artificial intelligence (AI) tools in solving authentic assessments. We employed Bloom's taxonomy as a guiding principle to create authentic assessments that evaluate the capabilities of generative AI tools. We applied this framework to assess the abilities of ChatGPT-4, ChatGPT-3.5, Google Bard and Microsoft Bing in solving authentic assessments in economics. We found that generative AI tools perform very well at the lower levels of Bloom's taxonomy while still maintaining a decent level of performance at the higher levels, with create being the weakest level of performance. Interestingly, these tools are better able to address numeric-based questions than text-based ones. Moreover, all the generative AI tools exhibit weaknesses in building arguments based on theoretical frameworks, maintaining the coherence of different arguments and providing appropriate references. Our study provides educators with a framework to assess the capabilities of generative AI tools, enabling them to make more informed decisions regarding assessments and learning activities. Our findings demand a strategic reimagining of educational goals and assessments, emphasising higher cognitive skills and calling for a concerted effort to enhance the capabilities of educators in preparing students for a rapidly transforming professional environment.",,,,,"Vo, Diem/IRY-9015-2023","Pham, Thi Thu Tra/0000-0001-7052-3323; Vo, Diem Thi Hong/0000-0002-5289-2325; , Binh/0000-0002-5036-8458; Thai, Hieu/0000-0001-9774-4388",,,,,,,,,,,,,1449-3098,1449-5554,,,,,2023,39,5,,,,,59,81,,10.14742/ajet.8902,http://dx.doi.org/10.14742/ajet.8902,,,,,,,,,,,,,WOS:001132966400001,View Full Record in Web of Science
J,"Walkowiak, E",,,,"Walkowiak, Emmanuelle",,,Task-interdependencies between Generative AI and Workers,ECONOMICS LETTERS,,,,,,,,,,,,"Our paper formalizes a production function to give microeconomic foundations for the adoption of Generative AI (GAI) within workplaces. The production function accounts for task-interdependencies, the worker-GAI interaction and indistinguishability between human-created and AI-generated outputs. We show that workers and GAI represent two distinct but interdependent sides of the production, that jointly generate a network externality in learning that drives productivity. We find that in open learning organizations favoring the worker-GAI interaction, GAI should be matched to workers based on their ability to detect errors. We analyze configurations where the worker-GAI interaction is limited, referred as closed learning organizations, including firms banning the use of GAI, technological superclusters and emergence of small entrepreneurs innovating with GAI.& COPY; 2023 The Author(s). Published by Elsevier B.V. This is an open access article under the CC BY license (http://creativecommons.org/licenses/by/4.0/).",,,,,"Walkowiak, Emmanuelle/IWU-6920-2023","Walkowiak, Emmanuelle/0000-0002-7153-614X",,,,,,,,,,,,,0165-1765,1873-7374,,,,OCT,2023,231,,,,,,,,111315,10.1016/j.econlet.2023.111315,http://dx.doi.org/10.1016/j.econlet.2023.111315,,AUG 2023,,,,,,,,,,,WOS:001068080000001,View Full Record in Web of Science
J,"Xi, K; Shao, XF",,,,"Xi, Kang; Shao, Xuefeng",,,Impact of AI applications on corporate green innovation,INTERNATIONAL REVIEW OF ECONOMICS & FINANCE,,,,,,,,,,,,"In the context of China's efforts to achieve carbon peaking and carbon neutrality goals, this study examined the impact of artificial intelligence (AI) applications on corporate green innovation (CGI) and the mechanism underlying such impact. Based on the panel data of 5209 Chinese listed firms from 2003 to 2022, this study empirically analyzed the relationship between AI applications and CGI using text analysis and econometric methods. The results revealed that AI applications significantly positively affect CGI. Additionally, media attention positively moderates the relationship between AI applications and CGI efficiency. Heterogeneity analysis further revealed the significantly different roles of various factors (e.g., region, industry, and nature of corporate ownership) in the relationship between AI applications and CGI. Our findings provide empirical support for the role of AI applications in achieving China's carbon peaking and carbon neutrality goals, and are of both theoretical and practical significance to promoting green transformation in China's economic development.",,,,,"Shao, Xuefeng/JRX-2145-2023",,,,,,,,,,,,,,1059-0560,1873-8036,,,,APR,2025,99,,,,,,,,104007,10.1016/j.iref.2025.104007,http://dx.doi.org/10.1016/j.iref.2025.104007,,MAR 2025,,,,,,,,,,,WOS:001444000300001,View Full Record in Web of Science
