J,"Nacheva, R; Jansone, A",,,,"Nacheva, Radka; Jansone, Anita",,,Heuristic Evaluation of AI-Powered Web Accessibility Assistants,BALTIC JOURNAL OF MODERN COMPUTING,,,,,,,,,,,,"Web-based services occupy an increasingly large place in the lives of people around the world. Users with disabilities may find it difficult to use many websites and platforms due to technical barriers. To improve access to websites, international organisations like International Organization for Standardization (ISO), European Telecommunications Standards Institute (ETSI), or World Wide Web Consortium (W3C) develop web accessibility standards and guidelines, which provide an introduction to accessibility issues. By following some basic recommendations, any website and platform can become a good environment for exchanging information to digitally include people with disabilities. Due to the rapid development of artificial intelligence (AI) recent 5 years and its application in various sectors (e.g., game industry, e-commerce, facial recognition systems, agriculture, financial and economic sectors, cyber security, education, etc.), this also implies its application to help people with special needs to ensure digital accessibility. In this regard, the aim of this paper is related to proposing a method for heuristic evaluation of AI powered web accessibility assistants. The method was tested using AI-powered accessibility assistants. The paper's objectives that meet its purpose and research questions are: (1) review of artificial intelligence application in web accessibility practices; (2) evaluation of selected tools based on the proposed method to prove its applicability. The method has been tested by heuristic evaluation of AI-powered accessibility assistants for websites. Web accessibility, measured in number of errors and alerts by applying WAVE tool, was compared before and after accessibility assistants were enabled.",,,,,"Jansone, Anita/AAI-1975-2021; Nacheva, Radka/G-1585-2015","Jansone, Anita/0000-0002-2419-7608",,,,,,,,,,,,,2255-8942,2255-8950,,,,,2023,11,4,,,,,542,557,,10.22364/bjmc.2023.11.4.02,http://dx.doi.org/10.22364/bjmc.2023.11.4.02,,,,,,,,,,,,,WOS:001135674600003,View Full Record in Web of Science
J,"Bao, Y; Gong, WK; Yang, KW",,,,"Bao, Ying; Gong, Wankun; Yang, Kaiwen",,,A Literature Review of Human-AI Synergy in Decision Making: From the Perspective of Affordance Actualization Theory,SYSTEMS,,,,,,,,,,,,"The emergence of artificial-intelligence (AI)-powered information technology, such as deep learning and natural language processing, enables human to shift their behaving or working diagram from human-only to human-AI synergy, especially in the decision-making process. Since AI is multidisciplinary by nature and our understanding of human-AI synergy in decision-making is fragmented, we conducted a literature review to systematically characterize the phenomenon. Adopting the affordance actualization theory, we developed a framework to organize and understand the relationship between AI affordances, the human-AI synergy process, and the outcomes of human-AI synergy. Three themes emerged from the review: the identification of AI affordances in decision-making, human-AI synergy patterns regarding different decision tasks, and outcomes of human-AI synergy in decision-making. For each theme, we provided evidence on the existing research gaps and proposed future research directions. Our findings provide a holistic framework for understanding human-AI synergy phenomenon in decision-making. This work also offers theoretical contributions and research directions for researchers studying human-AI synergy in decision-making.",,,,,,,,,,,,,,,,,,,,2079-8954,,,,SEP,2023,11,9,,,,,,,442,10.3390/systems11090442,http://dx.doi.org/10.3390/systems11090442,,,,,,,,,,,,,WOS:001074577400001,View Full Record in Web of Science
J,"Orchard, T; Tasiemski, L",,,,"Orchard, Tim; Tasiemski, Leszek",,,The rise of Generative AI and possible effects on the economy,ECONOMICS AND BUSINESS REVIEW,,,,,,,,,,,,"The aim of the paper is to analyse the likely implications of Generative AI (GAI) on various aspects of business and the economy. Amid the rapid growth and maturing of Generative AI technologies such as Large Language Models (like ChatGPT by OpenAI) a rapid growth of both immediate and potential applications can be seen. The implications for the economy and industries of this technological shift will be discussed. The foreseeable scenarios for the level and types of adoption that GAI might achieve-from useful analytical tool, invaluable assistant to the white-collar workers of the world to being trusted with a wide array of business and life-critical decision making. Both disruptive and premium service opportunities are foreseen. For instance, general purpose models may provide quality service-such as copywriting-to overserved customers leaving human writers as the premium option. In this context, overserved customers would be those who would be satisfied with a non-human, potentially less creative content. On the other hand highly specialized models-specifically trained in a given domain and with access to proprietary knowledge can possibly provide a premium service over that provided by human experts. It is expected that some jobs will be replaced by new AI applications. However, new workplaces will emerge. Not only the obvious expert-level data scientist roles but also low grade, model supervisors-people training the models, assessing the quality of responses given and handling escalations. Lastly new cybercrime risks emerging from the rise of GAI are discussed.",,,,,,,,,,,,,,,,,,,2392-1641,2450-0097,,,,APR 1,2023,9,2,,,,,9,26,,10.18559/ebr.2023.2.732,http://dx.doi.org/10.18559/ebr.2023.2.732,,,,,,,,,,,,,WOS:001037180500002,View Full Record in Web of Science
C,"Obergruber, P; Hrubcova, G",,"Iacob, AI",,"Obergruber, Petr; Hrubcova, Gabriela",,,Experiments in Economics,"3RD GLOBAL CONFERENCE ON BUSINESS, ECONOMICS, MANAGEMENT AND TOURISM",Procedia Economics and Finance,,,,"3rd Global Conference on Business, Economics, Management and Tourism (BEMTUR)","NOV 26-28, 2015","Rome, ITALY",,,,,"The experiment is one of base approach to scientific work for centuries. However, as Camerer & Loewenstein (2004) mentioned, many economists have long been pessimistic that an experimental approach could offer such vivid illustrations of cause and effect in their field. Difficulties of experimental approach are highly compensated by datasets and we would like to show how to use this experimental approach correctly. For this reason, we introduce the experimental design of our experiment and show some major problems with developing experiment, ways how to solve those problems or avoid the problem. Main theoretical focus of this essay is on paradigm about homo economicus and the ceteris paribus condition in the context of necessarily in economic research. Focus of the experiment part will be put on problematic of too complex experimental design, ways how to avoid that and through that shows also mistakes which could arise with development. (C) 2016 The Authors. Published by Elsevier B.V.",,,,,,,,,,,,,,,,,,,2212-5671,,,,,,2016,39,,,,,,482,492,,10.1016/S2212-5671(16)30352-5,http://dx.doi.org/10.1016/S2212-5671(16)30352-5,,,,,,,,,,,,,WOS:000387543400066,View Full Record in Web of Science
J,"Lee, Y; Ha, M; Kwon, S; Shim, Y; Kim, J",,,,"Lee, Yeonjoo; Ha, Miyeon; Kwon, Sujeong; Shim, Yealin; Kim, Jinwoo",,,Egoistic and altruistic motivation: How to induce users' willingness to help for imperfect AI,COMPUTERS IN HUMAN BEHAVIOR,,,,,,,,,,,,"Although artificial intelligence is a growing area of research, several problems remain. One such problem of particular importance is the low accuracy of predictions. This paper suggests that users' help is a practical approach to improve accuracy and it considers four factors that trigger users' willingness to help for an imperfect AI system. The two factors covered in Study 1 are utilitarian benefit based on egoistic motivation, and empathy based on altruistic motivation. In Study 2, utilitarian benefit is divided into explainable AI and monetary reward. The results indicate that two variables, namely empathy and monetary reward, have significant positive effects on willingness to help, and monetary reward is the strongest stimulus. In addition, explainable AI is shown to be positively associated with trust in AI. This study applies social studies of help motivation to the HCI field in order to induce users' willingness to help for an imperfect AI. The triggers of help motivation, empathy and monetary reward, can be utilized to induce the users' voluntary engagement in the loop with an imperfect AI.",,,,,,,,,,,,,,,,,,,0747-5632,1873-7692,,,,DEC,2019,101,,,,,,180,196,,10.1016/j.chb.2019.06.009,http://dx.doi.org/10.1016/j.chb.2019.06.009,,,,,,,,,,,,,WOS:000489190700020,View Full Record in Web of Science
J,"Sebestyn, M",,,,"Sebestyen, Marcell",,,Focal points and blind spots of human-centered AI: AI risks in written online media,HUMANITIES & SOCIAL SCIENCES COMMUNICATIONS,,,,,,,,,,,,"There is a strong tendency in prevailing discussions about artificial intelligence (AI) to focus predominantly on human-centered concerns, thereby neglecting the broader impacts of this technology. This paper presents a categorization of AI risks highlighted in public discourse, as reflected in written online media accounts, to provide a background for its primary focus: exploring the dimensions of AI threats that receive insufficient attention. Particular emphasis is dedicated to the ignored issues of animal welfare and the psychological impacts on humans, the latter of which surprisingly remains inadequately addressed despite the prevalent anthropocentric perspective of the public conversation. Moreover, this work also considers other underexplored dangers of AI development for the environment and, hypothetically, for sentient AI. The methodology of this study is grounded in a manual selection and meticulous, thematic, and discourse analytical manual examination of online articles published in the aftermath of the AI surge following ChatGPT's launch in late 2022. This qualitative approach is specifically designed to overcome the limitations of automated, surface-level evaluations typically used in media reviews, aiming to provide insights and nuances often missed by the mechanistic and algorithm-driven methods prevalent in contemporary research. Through this detail-oriented investigation, a categorization of the dominant themes in the discourse on AI hazards was developed to identify its overlooked aspects. Stemming from this evaluation, the paper argues for expanding risk assessment frameworks in public thinking to a morally more inclusive approach. It calls for a more comprehensive acknowledgment of the potential harm of AI technology's progress to non-human animals, the environment, and, more theoretically, artificial agents possibly attaining sentience. Furthermore, it calls for a more balanced allocation of focus among prospective menaces for humans, prioritizing psychological consequences, thereby offering a more sophisticated and capable strategy for tackling the diverse spectrum of perils presented by AI.",,,,,,,,,,,,,,,,,,,,2662-9992,,,,APR 23,2025,12,1,,,,,,,564,10.1057/s41599-025-04814-y,http://dx.doi.org/10.1057/s41599-025-04814-y,,,,,,,,,,,,,WOS:001473584200001,View Full Record in Web of Science
J,"Korinek, A",,,,"Korinek, Anton",,,Generative AI for Economic Research: Use Cases and Implications for Economists?,JOURNAL OF ECONOMIC LITERATURE,,,,,,,,,,,,"Generative artificial intelligence (AI) has the potential to revolutionize research. I analyze how large language models (LLMs) such as ChatGPT can assist economists by describing dozens of use cases in six areas: ideation and feedback, writing, back-ground research, data analysis, coding, and mathematical derivations. I provide gen-eral instructions and demonstrate specific examples of how to take advantage of each of these, classifying the LLM capabilities from experimental to highly useful. I argue that economists can reap significant productivity gains by taking advantage of gener-ative AI to automate micro-tasks. Moreover, these gains will grow as the performance of AI systems continues to improve. I also speculate on the longer-term implications of AI-powered cognitive automation for economic research. The online resources asso-ciated with this paper explain how to get started and will provide regular updates on the latest capabilities of generative AI in economics. (JEL A11, C45, D83, I23, O33)",,,,,,,,,,,,,,,,,,,0022-0515,2328-8175,,,,DEC,2023,61,4,,,,,1281,1317,,10.1257/jel.20231736,http://dx.doi.org/10.1257/jel.20231736,,,,,,,,,,,,,WOS:001144150800005,View Full Record in Web of Science
J,"Su, HS; Du, XY; Chen, Y; Tian, S; Ma, Q; Zhong, W",,,,"Su, Huishuang; Du, Xiaoyan; Chen, Yong; Tian, Shuo; Ma, Qiang; Zhong, Wei",,,Value co-creation mechanism for AI-based enterprises with systems thinking: Case study of Baidu,SYSTEMS RESEARCH AND BEHAVIORAL SCIENCE,,,,,,,,,,,,"How to realize value co-creation is a challenge for artificial intelligence (AI)-based enterprises. From the perspective of systems thinking, this paper conducts a case study on Baidu to explore the mechanism for Ai-based enterprises to realize value co-creation. The results indicate that value co-creation of AI companies goes through a dynamic iteration of three stages: start-up, growth, and maturity. Based on the finding, this paper proposes a model for AI-based enterprises to realize value co-creation with stakeholders under the interaction of innovation resilience and value proposition, as well as the combined effect of digital-intelligence empowerment, resource-focused action, and network embedding. Findings in this study not only fill the gap in existing literature but also provide insights for AI-based enterprises to realize sustainable development.",,,,,"Du, Xiaoyan/ABD-3167-2021; ma, qiang/HCI-1013-2022","Tian, Shuo/0000-0002-4864-8733; Su, Huishuang/0000-0003-4174-0411",,,,,,,,,,,,,1092-7026,1099-1743,,,,2024 AUG 21,2024,,,,,,,,,,10.1002/sres.3065,http://dx.doi.org/10.1002/sres.3065,,AUG 2024,,,,,,,,,,,WOS:001295050900001,View Full Record in Web of Science
C,"Joao, BN",,"Zimmermann, R; Rodrigues, JC; Simoes, A; Dalmarco, G",,"Joao, Belmiro N.",,,AI-Based Innovation in Precision Agriculture: Studies of Brazilian AgTechs,"HUMAN-CENTRED TECHNOLOGY MANAGEMENT FOR A SUSTAINABLE FUTURE, VOL 2, IAMOT",Springer Proceedings in Business and Economics,,,,33rd International Association for the Management of Technology Conference,"JUL 08-11, 2024","Porto, PORTUGAL",,,,,"Content AgTech is a company using technology in agriculture to increase productivity and efficiency. Technologies like machine learning have prominence in Precision Agriculture. Relevance Integrating AI into PA promotes efficiency, productivity, and sustainability. Allowing the optimization of resource use and facilitating data-based decision-making contribute to food security and the mitigation of environmental impacts. Literature Gap we work with the alignment between the creation of knowledge in AI and the creation of startups in agriculture based on the Knowledge Overflow Theory of Entrepreneurship and advance the literature on AI-based innovation. Objective This research aimed to identify and analyze where knowledge is created in AI to AgTech. Methodology We show three case studies of AgTech that helped this transformation and attracted the growing interest in venture capital. Results AgTechs have an above-average demand for technological expertise, funding, and knowledge. Crop monitoring control by remote sensing management is an example of a solution involving the participation of leading institutions and experts in the innovation ecosystem, including leading universities.",,,,,,,,,,,,,,,,,,,2198-7246,2198-7254,978-3-031-72496-1; 978-3-031-72494-7; 978-3-031-72493-0,,,,2025,,,,,,,467,474,,10.1007/978-3-031-72494-7_46,http://dx.doi.org/10.1007/978-3-031-72494-7_46,,,,,,,,,,,,,WOS:001454289900046,View Full Record in Web of Science
J,"Tian, J; Lin, HX; Tourky, M; Cheng, B",,,,"Tian, Jian; Lin, Hongxia; Tourky, Marwa; Cheng, Bao",,,The impact of AI service failure on human employee behavior and customer service performance,INTERNATIONAL JOURNAL OF CONTEMPORARY HOSPITALITY MANAGEMENT,,,,,,,,,,,,"PurposeThis study aims to investigate how and when artificial intelligence (AI) service failure stimulates employees' differentiated work behaviors.Design/methodology/approachA multi-wave, multi-source survey involving 284 employee-supervisor pairs was conducted across 15 four-star and five-star hotels in Guangzhou, China. Hierarchical multiple regression analysis was used to test the hypotheses.FindingsFindings suggest that AI service failure induces schadenfreude toward the organization among employees with low perceived insider status, which then leads to procrastination behavior; however, it triggers sympathy toward the organization among employees with high perceived insider status, which further results in proactive customer service performance (PCSP).Practical implicationsTheir work offers practical insights for tourism and hospitality companies on promoting PCSP and reducing procrastination behaviors among service employees in response to AI service failures.Originality/valueBy incorporating perceived insider status as a moderator, and examining the mediating roles of schadenfreude and sympathy toward the organization, this research enhances the theoretical understanding of AI service failure and its consequences from the employee perspective.",,,,,"Tourky, Marwa/AFQ-4112-2022; Lin, Hongxia/KHE-2841-2024",,,,,,,,,,,,,,0959-6119,1757-1049,,,,2025 APR 21,2025,,,,,,,,,,10.1108/IJCHM-08-2024-1209,http://dx.doi.org/10.1108/IJCHM-08-2024-1209,,APR 2025,,,,,,,,,,,WOS:001468142300001,View Full Record in Web of Science
J,"Turlakova, SS; Shumilo, YM",,,,"Turlakova, S. S.; Shumilo, Ya. M.",,,INFLUENCE OF AI TOOLS ON CONSUMER BEHAVIOR MANAGEMENT IN DIGITAL MARKETING,SCIENCE AND INNOVATION,,,,,,,,,,,,"Introduction. With the rapid advancement of digital technologies, online advertising has become essential for eff ective brand communication with target audiences in digital spaces. Problem Statement. It has been hypothesized that artificial intelligence (AI) tools can enhance the effectiveness of advertising campaigns, leading to increased sales, higher profits for advertisers, and improved returns on marketing investments. Purpose. This study aims to examine the impact of AI tools on managing consumer behavior in digital marketing. Material and Methods. An experiment has been conducted on the Meta Ads platform to compare the outcomes of advertising campaigns confi gured with AI tools versus manual settings. Two test groups of advertising campaigns have been selected based on the competence and awareness of the management targets. Using Kohonen maps, the reflexive characteristics of the management targets in these groups have been assessed. By employing both manual settings and AI tools, an experiment has been carried out by a digital marketing specialist to modify potential customers' reflexive characteristics and investigate changes in their behavior regarding targeted actions within the advertising campaigns. Results have been compared across both configurations. Results. The study has shown that AI tools enable effective influence on user behavior in digital spaces. AI-gene rated recommendations have led to increased reach, clicks, and conversions from ad links, with the greatest efficiency observed when targeting potential customers. Potential areas for further research have also been identified. Conclusions. Leveraging AI tools in Meta Ads campaigns enables advertisers to increase product sales and improve returns on marketing investments.",,,,,"Svitlana, Turlakova/B-7771-2018","Svitlana, Turlakova/0000-0002-3954-8503; Shumilo, Yana/0000-0001-7726-4037",,,,,,,,,,,,,2409-9066,2413-4996,,,,,2025,21,1,,,,,67,81,,10.15407/scine21.01.067,http://dx.doi.org/10.15407/scine21.01.067,,,,,,,,,,,,,WOS:001410904300005,View Full Record in Web of Science
J,"Xing, YF; He, W; Zhang, JZ; Cao, GH",,,,"Xing, Yunfei; He, Wu; Zhang, Justin Zuopeng; Cao, Gaohui",,,AI Privacy Opinions between US and Chinese People,JOURNAL OF COMPUTER INFORMATION SYSTEMS,,,,,,,,,,,,"This paper comparatively studies people's opinions on AI privacy between the US and China. Based on data collected from Twitter and Weibo, we perform text clustering and content analysis to classify opinion types and analyze the symptoms of opinion polarization and drivers by regression analysis. Results show that US people express more concerns about AI privacy, focusing more on privacy disclosure by AI applications. In contrast, Chinese people are more optimistic about AI's role in promoting privacy protection. Security, economics, and application are driving factors leading to the polarization of the US people, while technologies and algorithms influence the polarization of Chinese people. This study offers methodological guidance for examining the relationship between AI and user privacy. It also guides the government agencies and other practitioners in developing the policies on AI regulations for privacy protection.",,,,,"Zhang, Justin/M-9298-2019","Zhang, Justin/0000-0002-4074-9505; Xing, Yunfei/0000-0002-5512-4364",,,,,,,,,,,,,0887-4417,2380-2057,,,,MAY 4,2023,63,3,,,,,492,506,,10.1080/08874417.2022.2079107,http://dx.doi.org/10.1080/08874417.2022.2079107,,MAY 2022,,,,,,,,,,,WOS:000807629900001,View Full Record in Web of Science
J,"He, JH; He, CH; Sedighi, HM",,,,"He, Ji-Huan; He, Chun-Hui; Sedighi, Hamid M.",,,Evans model for dynamic economics revised,AIMS MATHEMATICS,,,,,,,,,,,,"This paper argues that any economic phenomena should be observed by two different scales, and any economic laws are scale-dependent. A one-scale law arising in either macroeconomics or microeconomics might be mathematically correct and economically relevant, however, sparking debates might arise for a different scale. This paper re-analyzes the basic assumptions of the Evans model for dynamic economics, and it concludes that they are quite reasonable on a large time-scale, but the assumptions become totally invalid on a smaller scale, and a fractal modification has to be adopted. A two-scale price dynamics is suggested and a fractal variational theory is established to maximize the profit at a given period. Furthermore Evans 1924 variational principle for the maximal profit is easy to be solved for a quadratic cost function using the Lagrange multiplier method. Here a quadratic-cubic cost function and a nonlinear demand function are used, and the stationary condition of the variational formulation is derived step by step, and a more complex dynamic system is obtained. The present derivation process can be extended to a more complex cost function and a more complex demand function, and the paper sheds a promising light on mathematics treatment of complex economic problems.",,,,,"He, Ji-Huan/K-8504-2013; He, Chunhui/H-8111-2015; Sedighi, Hamid/H-9656-2012","Mohammad-Sedighi, Hamid/0000-0002-3852-5473",,,,,,,,,,,,,,2473-6988,,,,,2021,6,9,,,,,9194,9206,,10.3934/math.2021534,http://dx.doi.org/10.3934/math.2021534,,,,,,,,,,,,,WOS:000685892800005,View Full Record in Web of Science
J,"Baltezarevic, R; Baltezarevic, I",,,,"Baltezarevic, Radoslav; Baltezarevic, Ivana",,,Students' Attitudes on The Role of Artificial Intelligence (Ai) In Personalized Learning,INTERNATIONAL JOURNAL OF COGNITIVE RESEARCH IN SCIENCE ENGINEERING AND EDUCATION-IJCRSEE,,,,,,,,,,,,"Educational institutions are increasingly incorporating new technologies into their classrooms, such as artificial intelligence (AI), enabling more innovative teaching methods and learning experiences. Unlike traditional teaching methods, where lecturers adapt their lectures to the needs of the average student, AI-powered educational platforms are more dynamic and productive, as they can be adapted to the preferences, learning styles and pace of each student, enabling personalized learning. The aim of this study is to gather information that will help educators, legislators, and AI developers optimize AI's role in education for increased student achievement by examining students' attitudes toward the implementation of AI in personalized learning. The findings of this study may have an immense effect on how AI is used in educational settings in the future, because they may provide better understanding that would enable students to receive more individualized instruction and autonomy while also increasing pedagogical opportunities and reducing an excessive amount of administrative work for educators. 219 students of Megatrend University in Belgrade participated in the research (all three study levels), to whom the questionnaire was sent by e-mail. The results indicate that students believe that: a) If the application of AI makes learning personalized, the greater the possibility for students to identify their abilities and creativity; b) If lecturers apply the most effective teaching methods using AI, they can significantly automate the monitoring of student progress; c) If innovative and interesting learning opportunities are applied in classes, the greater the interactivity of students in the teaching process; d) AI can examine past student performance to identify areas of difficulty and provide tailored assistance in those areas.",,,,,,,,,,,,,,,,,,,2334-847X,2334-8496,,,,AUG,2024,12,2,,,,,,,,10.23947/2334-8496-2024-12-2-373-385,http://dx.doi.org/10.23947/2334-8496-2024-12-2-373-385,,,,,,,,,,,,,WOS:001315172100005,View Full Record in Web of Science
