J,"De Caigny, A; Coussement, K; Hoornaert, S; Meire, M",,,,"De Caigny, Arno; Coussement, Kristof; Hoornaert, Steven; Meire, Matthijs",,,Life event-based marketing using AI,JOURNAL OF BUSINESS RESEARCH,,,,,,,,,,,,"This paper investigates how firms can leverage innovative data sources and Artificial Intelligence (AI) for life event prediction to better manage the relationship with their customers. In this study, we leverage deep learning to explore the added value of incorporating textual customer-generated data in life event prediction models. Furthermore, we propose a new framework to calculate the profit of life event based-marketing campaigns. We empirically validate our research questions on a real-world dataset including 94,161 email messages of 21,898 customers in the financial services industry. First, we show that life events have a significant impact on both product possession and customer value. Second, we demonstrate that textual data significantly boosts the predictive performance of life event prediction models. Third, our framework to calculate profit for life event-based marketing campaigns shows that running such campaigns can lead to a substantial return on investment but requires a performant life event prediction model.",,,,,"Meire, Matthijs/MTD-0127-2025; De Caigny, Arno/S-3693-2019","Meire, Matthijs/0000-0002-3246-5668",,,,,,,,,,,,,0148-2963,1873-7978,,,,APR,2025,193,,,,,,,,115349,10.1016/j.jbusres.2025.115349,http://dx.doi.org/10.1016/j.jbusres.2025.115349,,,,,,,,,,,,,WOS:001469098800001,View Full Record in Web of Science
C,"Iwendi, C; Lakshmi, CS; Veerasamy, BD; Hollins, P; Adeola, D; Hewage, P; Aderemi, AP; Shukla, PK",,,IEEE,"Iwendi, Celestine; Lakshmi, Chatti Subba; Veerasamy, Bala Dhandayuthapani; Hollins, Paul; Adeola, Damilare; Hewage, Pradeep; Aderemi, Adedapo Paul; Shukla, Piyush Kumar",,,Empowering Marketing Management and Gaming Consumer Interaction through AI and Citizen Science,"2024 IEEE GAMING, ENTERTAINMENT, AND MEDIA CONFERENCE, GEM 2024",IEEE Games Media Entertainment,,,,"Gaming, Entertainment and Media Conference (GEM)","JUN 05-07, 2024","Turin, ITALY",,,,,"There has been a significant revolution seen by AI getting incorporated into the management and customer relations of companies. The research of the present Artificial Intelligence (AI) revolution that influences a variety of fields i.e. video games are the topic of the article. AI systems such as machine learning and data analytics can help brands understand consumer behaviour in much greater detail; hence, companies can better reach and interest potential consumers through personalized marketing plans and campaigns. This is another case of citizen science that can host a large number of artisanal anglers who can together provide data that can make the research wider-reaching. The proposed scheme improves the level of customer accuracy and tackles trends timely as well as creates slight space for real-time communication by applying neighbour-based recommendation techniques, neural networks, and sentiment analysis. Its supremacy over the conventional methods of statistical significance is highlighted through the advent of predictive analytics and dynamic pricing approaches. The advantage of deploying natural language processing (NLP) is that it helps to understand what the customers mean with how they write. Measuring the key performance indicators at the end of this approach can be called the method of adaptation and flexibility which makes digital marketing not just refer only the success but also turn to the happiness of customers.",,,,,"Hollins, Paul/IAM-6380-2023; V., Dr. Bala Dhandayuthapani/F-7837-2011; Iwendi, Celestine/I-1989-2018; user, user/GLQ-6797-2022","Adeola, Lare/0009-0004-6310-5931; Aderemi, Adedapo/0009-0006-5600-6112; Veerasamy, Dr. Bala Dhandayuthapani/0000-0002-8310-0642",,,,,,,,,,,,,2831-5510,,979-8-3503-7453-7; 979-8-3503-7454-4,,,,2024,,,,,,,373,378,,10.1109/GEM61861.2024.10585727,http://dx.doi.org/10.1109/GEM61861.2024.10585727,,,,,,,,,,,,,WOS:001281983200117,View Full Record in Web of Science
J,"Zong, ZP; Anwar, MA; Khan, S; Asmi, F; Hussain, N",,,,"Zong, Zupan; Anwar, Muhammad Azfar; Khan, Sana; Asmi, Fahad; Hussain, Nazim",,,Big-data AI analytics in value-chain innovation and international marketing strategy: insights from SMEs in cultural and creative industries,INTERNATIONAL MARKETING REVIEW,,,,,,,,,,,,"Purpose Despite great consensus on the positive impact of big-data-driven artificial intelligence (AI) analytics (BDAI) on a firm's performance, it still appears to be a black box mechanism through which small and medium-sized enterprises (SMEs) strengthen their dynamic competencies to innovate and expand their global footprint. To fill this theoretical and empirical gap we examine the relationship between BDAI affordances, digital marketing capabilities (DMCs), value-chain innovation and international market goals.Design/methodology/approach The study incorporates the dynamic capability view an extension of the resource-based view and the knowledge-based view to empirically examine the primary data collected from marketing managers and executives of SMEs in cultural and creative industries utilizing Structural Equation Modeling (SEM) analysis.Findings The study highlights the significant role of BDAI affordances such as intelligent process recommendations, customer intelligence and market intelligence on DMCs, where DMCs significantly affect value-chain innovation and international market strategy both directly and indirectly.Research limitations/implications The study minimizes the gap in identifying the BDAI affordances to drive innovation and international market strategy in the context of SMEs in cultural and creative industries. Marketing managers can incorporate these findings to enhance their digital capabilities for competitive advantages in international markets.Originality/value The study proposes a holistic framework of BDAI affordances for the strategic use of digital resources and knowledge to transform digital capabilities into new forms of value to expand in the international market. These insights are robust and grounded in findings provided by marketing practitioners.",,,,,"Hussain, Nazim/ABE-4384-2021; Asmi, Fahad/B-3024-2018","Asmi, Fahad/0000-0002-3260-4277",,,,,,,,,,,,,0265-1335,1758-6763,,,,2025 JAN 23,2025,,,,,,,,,,10.1108/IMR-02-2024-0049,http://dx.doi.org/10.1108/IMR-02-2024-0049,,JAN 2025,,,,,,,,,,,WOS:001401225600001,View Full Record in Web of Science
J,"Bulchand-Gidumal, J; Secin, EW; O'Connor, P; Buhalis, D",,,,"Bulchand-Gidumal, Jacques; Secin, Eduardo William; O'Connor, Peter; Buhalis, Dimitrios",,,Artificial intelligence's impact on hospitality and tourism marketing: exploring key themes and addressing challenges,CURRENT ISSUES IN TOURISM,,,,,,,,,,,,"Understanding how Artificial Intelligence (AI) impacts organizational functions supports stakeholders to prepare accordingly and profit from these developments. Adopting a grounded theory approach, this study uses three interlinked stages (in-depth interviews, focus groups and a questionnaire-based survey) to explore the impact of AI on the marketing function of hotels. The results identify ten trends related to AI's contribution to hotel marketing, clustered in four themes. AI reengineers internal processes and procedures by enabling data and content as catalysts of competitiveness; empowering the augmented worker and performing mass personalization and customization. AI also impacts relationships with stakeholders by determining return on investment; improving sustainability; and governing legal aspects and ethics regarding data use. AI supports networks to which the organizations belong by concentrating and integrating organizations and transforming distribution models. AI transforms customer processes and services by engaging smart and predictive customer care and by employing predictive and augmented product and service design. The study illustrates the changes that AI will likely bring to hospitality and tourism marketing, developing a research agenda and raising discussion points for academic and industry practitioners respectively.",,,,,"Buhalis, Dimitrios/C-2045-2008; Bulchand-Gidumal, Jacques/IUQ-6074-2023; O'Connor, Peter/AAW-5994-2020; Bulchand-Gidumal, Jacques/K-6642-2014","Bulchand-Gidumal, Jacques/0000-0001-8522-2013; William, Edu/0009-0007-3220-4795; O'Connor, Peter/0000-0002-8524-0235",,,,,,,,,,,,,1368-3500,1747-7603,,,,JUL 17,2024,27,14,,,,,2345,2362,,10.1080/13683500.2023.2229480,http://dx.doi.org/10.1080/13683500.2023.2229480,,JUL 2023,,,,,,,,,,,WOS:001019909000001,View Full Record in Web of Science
J,"Gerlich, M",,,,"Gerlich, Michael",,,The Shifting Influence: Comparing AI Tools and Human Influencers in Consumer Decision-Making,AI,,,,,,,,,,,,"This study investigates the evolving role of artificial intelligence (AI) in consumer decision-making, particularly in comparison to traditional human influencers. As consumer trust in social media influencers has declined, largely due to concerns about the financial motivations behind endorsements, AI tools such as ChatGPT have emerged as perceived neutral intermediaries. The research aims to understand whether AI systems can replace human influencers in shaping purchasing decisions and, if so, in which sectors. A mixed-methods approach was employed, involving a quantitative survey of 478 participants with prior experience using both AI tools and interacting with social media influencers, complemented by 15 semi-structured interviews. The results reveal that AI is favoured over human influencers in product categories where objectivity and precision are critical, such as electronics and sporting goods, while human influencers remain influential in emotionally driven sectors like fashion and beauty. These findings suggest that the future of marketing will show a reduced need for human social media influencers and may involve a hybrid model where AI systems dominate data-driven recommendations and human influencers continue to foster emotional engagement. This shift has important implications for brands as they adapt to changing consumer trust dynamics.",,,,,"Gerlich, Michael/GQA-3552-2022","Gerlich, Michael/0000-0003-4033-4403",,,,,,,,,,,,,,2673-2688,,,,JAN,2025,6,1,,,,,,,11,10.3390/ai6010011,http://dx.doi.org/10.3390/ai6010011,,,,,,,,,,,,,WOS:001403945100001,View Full Record in Web of Science
J,"Khan, AW; Mishra, A",,,,"Khan, Abdul Wahid; Mishra, Abhishek",,,AI credibility and consumer-AI experiences: a conceptual framework,JOURNAL OF SERVICE THEORY AND PRACTICE,,,,,,,,,,,,"PurposeThis study aims to conceptualize the relationship of perceived artificial intelligence (AI) credibility with consumer-AI experiences. With the widespread deployment of AI in marketing and services, consumer-AI experiences are common and an emerging research area in marketing. Various factors affecting consumer-AI experiences have been studied, but one crucial factor - perceived AI credibility is relatively underexplored which the authors aim to envision and conceptualize.Design/methodology/approachThis study employs a conceptual development approach to propose relationships among constructs, supported by 34 semi-structured consumer interviews.FindingsThis study defines AI credibility using source credibility theory (SCT). The conceptual framework of this study shows how perceived AI credibility positively affects four consumer-AI experiences: (1) data capture, (2) classification, (3) delegation, and (4) social interaction. Perceived justice is proposed to mediate this effect. Improved consumer-AI experiences can elicit favorable consumer outcomes toward AI-enabled offerings, such as the intention to share data, follow recommendations, delegate tasks, and interact more. Individual and contextual moderators limit the positive effect of perceived AI credibility on consumer-AI experiences.Research limitations/implicationsThis study contributes to the emerging research on AI credibility and consumer-AI experiences that may improve consumer-AI experiences. This study offers a comprehensive model with consequences, mechanism, and moderators to guide future research.Practical implicationsThe authors guide marketers with ways to improve the four consumer-AI experiences by enhancing consumers' perceived AI credibility.Originality/valueThis study uses SCT to define AI credibility and takes a justice theory perspective to develop the conceptual framework.",,,,,"Mishra, Abhishek/ITU-3515-2023; Khan, Abdul Wahid/GLS-0624-2022","Mishra, Abhishek/0000-0001-9634-5545; Khan, Abdul Wahid/0000-0001-9327-290X",,,,,,,,,,,,,2055-6225,,,,,JAN 2,2024,34,1,,,SI,,66,97,,10.1108/JSTP-03-2023-0108,http://dx.doi.org/10.1108/JSTP-03-2023-0108,,DEC 2023,,,,,,,,,,,WOS:001112158100001,View Full Record in Web of Science
J,"Eriksson, T; Bigi, A; Bonera, M",,,,"Eriksson, Theresa; Bigi, Alessandro; Bonera, Michelle",,,"Think with me, or think for me? On the future role of artificial intelligence in marketing strategy formulation",TQM JOURNAL,,,,,,,,,,,,"PurposeThis paper explores if and how Artificial Intelligence can contribute to marketing strategy formulation.Design/methodology/approachQualitative research based on exploratory in-depth interviews with industry experts currently working with artificial intelligence tools.FindingsKey themes include: (1) Importance of AI in strategic marketing decision management; (2) Presence of AI in strategic decision management; (3) Role of AI in strategic decision management; (4) Importance of business culture for the use of AI; (5) Impact of AI on the business' organizational model. A key consideration is a creative-possibility perspective, highlighting the future potential to use AI not only for rational but also for creative thinking purposes.Research limitations/implicationsThis work is focused only on strategy creation as a deliberate process. For this, AI can be used as an effective response to the external contingencies of high volumes of data and uncertain environmental conditions, as well as being an effective response to the external contingencies of limited managerial cognition. A key future consideration is a creative-possibility perspective.Practical implicationsA practical extension of the Gartner Analytics Ascendancy Model (Maoz, 2013).Originality/valueThis paper aims to contribute knowledge relating to the role of AI in marketing strategy formulation and explores the potential avenues for future use of AI in the strategic marketing process. This is explored through the lens of contingency theory, and additionally, findings are expressed using the Gartner analytics ascendancy model.",,,,,"Bonera, Michelle/AAD-5730-2019; Bigi, Alessandro/AAD-3981-2019; Eriksson, Thomas/F-9362-2016","BONERA, Michelle/0000-0002-3669-5356; Bigi, Alessandro/0000-0003-0661-4575",,,,,,,,,,,,,1754-2731,1754-274X,,,,JUL 21,2020,32,4,,,SI,,795,814,,10.1108/TQM-12-2019-0303,http://dx.doi.org/10.1108/TQM-12-2019-0303,,,,,,,,,,,,,WOS:000998655700011,View Full Record in Web of Science
J,"Ahmad, N; Haque, S",,,,"Ahmad, Norita; Haque, Sabir",,,Balancing Innovation and Ethics in AI- and Big Data-Driven Marketing,COMPUTER,,,,,,,,,,,,Ethical governance and human oversight are essential for maintaining integrity in AI-driven marketing. Collaboration between stakeholders and integration of ethical AI frameworks are critical for ensuring responsible and fair marketing practices.,,,,,"Haque, Sabir/JBD-2280-2023","Ahmad, Norita/0000-0001-5129-1133; Haque, Sabir/0000-0001-9516-7062",,,,,,,,,,,,,0018-9162,1558-0814,,,,AUG,2024,57,8,,,,,102,107,,10.1109/MC.2024.3405708,http://dx.doi.org/10.1109/MC.2024.3405708,,,,,,,,,,,,,WOS:001297963200012,View Full Record in Web of Science
J,"Bartelt, C; Rser, AM",,,,"Bartelt, Cedric; Roeser, Alexander Maximilian",,,Transforming the Operational Components of Marketing Processes with GenAI: A Paradigm Shift,ADVANCES IN ARTIFICIAL INTELLIGENCE AND MACHINE LEARNING,,,,,,,,,,,,"Generative Artificial Intelligence (GenAI) is transforming marketing through advanced content creation, personalized customer interactions, and strategic optimization. This study explores GenAI's impact on marketing processes, current applications, and related ethical and strategic challenges. A meta-analysis of the existing literature was conducted, focusing on GenAI integration in marketing. Relevant research was collected from various databases and rigorously evaluated, with case studies illustrating practical applications and benefits. The findings show that GenAI enhances marketing efficiency by automating content creation, improving customer service, and optimizing strategies using specialized AI tools. However, GenAI's use is currently fragmented, focusing more on operational than strategic tasks. This study underscores the necessity for a comprehensive and integrated approach to fully leverage the potential of GenAI in marketing processes, with the intention of effecting a paradigm shift, particularly in operational marketing tasks. Future research should focus on developing integrated GenAI solutions that comprehensively address all facets of the marketing process, including strategic decision- making, ethical and regulatory considerations, and long-term impact assessment, while exploring innovative applications and optimizing existing technologies to fully harness GenAI's potential in driving a holistic digital transformation of marketing.",,,,,,,,,,,,,,,,,,,,2582-9793,,,,JUL,2024,4,3,,,,,2535,2544,,,,,,,,,,,,,,,,WOS:001327784400009,View Full Record in Web of Science
J,"Jain, R; Kumar, A",,,,"Jain, Richali; Kumar, Ajay",,,Artificial Intelligence in Marketing: Two Decades Review,NMIMS MANAGEMENT REVIEW,,,,,,,,,,,,"Advancements in big data analytics, IoT, and artificial intelligence (AI) have significantly transformed marketing practices and consumer behavior. AI offers promising opportunities for marketing practice and research. However, marketers need a holistic understanding of AI and its influence on consumers. Thus, this study aims to offer a review of AI applications in marketing and explore the role of AI in aiding marketing. This study carries out a review of AI and its applications in marketing by analysing the existing literature between 2000 and 2021. Only those papers were selected for this review, which are positioned around AI technology. Articles were drawn from Google Scholar and Scopus databases and were analysed using thematic analysis. A review of selected papers depicts that AI implementation in marketing is still in its nascent stage. The review proposed the following themes: (a) Prediction Analysis, (b) Relationships with AI, (c) Consumer Relationship Management, (d) AI in Strategic Marketing, (e) AI and Services, (f) Conversational Commerce, (g) Advertising and Artificial Intelligence, and (h) Consumer Brand Engagement.",,,,,"KUMAR, AJAY/Y-5736-2019","Jain, Richali/0000-0002-2847-8650",,,,,,,,,,,,,0971-1023,,,,,JUN,2024,32,2,,,,,75,83,,10.1177/09711023241272308,http://dx.doi.org/10.1177/09711023241272308,,SEP 2024,,,,,,,,,,,WOS:001313927800001,View Full Record in Web of Science
J,"Ferrell, OC; Ferrell, L",,,,"Ferrell, O. C.; Ferrell, Linda",,,Building a Better World: The Role of AI Ethics and Social Responsibility,JOURNAL OF MACROMARKETING,,,,,,,,,,,,"In an era where artificial intelligence (AI) is rapidly transforming marketing, the tensions associated with ethics and social responsibility are accelerating. This commentary addresses and expands upon what Grewal, Guha and Becker (2024) term Theme #3-AI created novel tensions. The differences between AI ethics and social responsibility are defined, including directions for collaborative efforts needed by managers and developers of AI. To serve society, all stakeholders need to be involved in addressing the tensions associated with AI applications. AI principles such as transparency, accountability and fairness need to be translated into rules to develop algorithms. This process should be a part of strategic organizational management of the organizational compliance function. AI should not be just a tool or tactic to ensure efficiency. The risks and opportunities should be managed to create a better world.",,,,,,,,,,,,,,,,,,,0276-1467,1552-6534,,,,DEC,2024,44,4,,,,,928,935,,10.1177/02761467241285793,http://dx.doi.org/10.1177/02761467241285793,,SEP 2024,,,,,,,,,,,WOS:001321611500001,View Full Record in Web of Science
J,"Wen, YT; Laporte, S",,,,"Wen, Yingting; Laporte, Sandra",,,Experiential Narratives in Marketing: A Comparison of Generative AI and Human Content,JOURNAL OF PUBLIC POLICY & MARKETING,,,,,,,,,,,,"As generative AI technologies advance, understanding their capability to emulate human-like experiences in marketing communication becomes crucial. This research examines whether generative AI can create experiential narratives that resonate with humans in terms of embodied cognition, affect, and lexical diversity. An automated text analysis reveals that while reviews generated by ChatGPT 3.5 exhibit lower levels of embodied cognition and lexical diversity compared with reviews by human experts, they display more positive affect (Study 1a). However, human raters struggle to notice these differences, rating half of the selected reviews from AI higher in embodied cognition and usefulness (Study 1b). Instances of hallucination in AI-generated content were detected by human raters. For social media posts, the more sophisticated ChatGPT 4 model demonstrates superior perceived lexical diversity and leads to higher purchase intentions in unbranded content compared with human copywriters (Study 2). This research evaluates the performance of large language models in generating experiential marketing narratives. The comparative studies reveal the models' strengths in presenting positive emotions and influencing purchase intent while identifying limitations in embodied cognition and lexical diversity compared with human-authored content. The findings have implications for marketers and policy makers in understanding generative AI's potential and risks in marketing.",,,,,,,,,,,,,,,,,,,0743-9156,1547-7207,,,,2025 JAN 23,2025,,,,,,,,,,10.1177/07439156241297973,http://dx.doi.org/10.1177/07439156241297973,,JAN 2025,,,,,,,,,,,WOS:001402786200001,View Full Record in Web of Science
C,"Ribeiro, T; Reis, JL",,"Rocha, A; Adeli, H; Reis, LP; Costanzo, S; Orovic, I; Moreira, F",,"Ribeiro, Tiago; Reis, Jose Luis",,,Artificial Intelligence Applied to Digital Marketing,"TRENDS AND INNOVATIONS IN INFORMATION SYSTEMS AND TECHNOLOGIES, VOL 2",Advances in Intelligent Systems and Computing,,,,World Conference on Information Systems and Technologies (WorldCIST),"APR 07-10, 2020","Budva, MONTENEGRO",,,,,"Based on the theory that both manual and cognitive tasks can be replaced by Artificial Intelligence, this study explores, using a qualitative research method, the impact of Artificial Intelligence (AI) in Digital Marketing. An analysis of interviews with 15 experts from different industries related to Marketing and AI shows that AI have impact in Marketing processes and the impact will be bigger in the future. The study reinforces that many of the manual and repetitive tasks of a marketer's life can already be replaced by AI, and the use of machines working together with humans are the key to better marketing results. The challenges and ethical aspects that lead to a slow or non-adoption of AI have been addressed, and one of the major obstacles is that humans aren't yet confident in technology and, they are not yet ready for this cultural change. Based on these findings, business decision-makers and managers need to prepare their companies and employees for the implementation of AI in Marketing.",,,,,,,,,,,,,,,,,,,2194-5357,2194-5365,978-3-030-45690-0; 978-3-030-45691-7,,,,2020,1160,,,,,,158,169,,10.1007/978-3-030-45691-7_15,http://dx.doi.org/10.1007/978-3-030-45691-7_15,,,,,,,,,,,,,WOS:001300369900015,View Full Record in Web of Science
J,"Tully, SM; Longoni, C; Appel, G",,,,"Tully, Stephanie M.; Longoni, Chiara; Appel, Gil",,,Lower Artificial Intelligence Literacy Predicts Greater AI Receptivity,JOURNAL OF MARKETING,,,,,,,,,,,,"As artificial intelligence (AI) transforms society, understanding factors that influence AI receptivity is increasingly important. The current research investigates which types of consumers have greater AI receptivity. Contrary to expectations revealed in four surveys, cross-country data and six additional studies find that people with lower AI literacy are typically more receptive to AI. This lower literacy-greater receptivity link is not explained by differences in perceptions of AI's capability, ethicality, or feared impact on humanity. Instead, this link occurs because people with lower AI literacy are more likely to perceive AI as magical and experience feelings of awe in the face of AI's execution of tasks that seem to require uniquely human attributes. In line with this theorizing, the lower literacy-higher receptivity link is mediated by perceptions of AI as magical and is moderated among tasks not assumed to require distinctly human attributes. These findings suggest that companies may benefit from shifting their marketing efforts and product development toward consumers with lower AI literacy. In addition, efforts to demystify AI may inadvertently reduce its appeal.",,,,,"Longoni, Chiara/GVS-8858-2022; Appel, Gil/AEX-5626-2022",,,,,,,,,,,,,,0022-2429,1547-7185,,,,2025 JAN 13,2025,,,,,,,,,,10.1177/00222429251314491,http://dx.doi.org/10.1177/00222429251314491,,JAN 2025,,,,,,,,,,,WOS:001470829100001,View Full Record in Web of Science
